MCQ,Choices,Correct
What is Machine Learning (ML)?,"a : A type of artificial intelligence that enables computers to learn and improve over time, based on data and experience, without being explicitly programmed. | b : A subset of artificial intelligence that focuses on the development of algorithms for data mining and pattern recognition tasks. | c : The process of training a model by providing explicit instructions and rules to follow in order to make predictions or take actions. | d : A technique used in natural language processing to automatically generate responses based on statistical analysis of large text datasets.",a
What are the key characteristics of ML algorithms?,"a : They can learn from data and generalize to new, unseen data. | b : They always require a large amount of data to train effectively. | c : They are exclusively used for artificial neural network development. | d : They are a subset of deep learning algorithms.",a
Which field is closely related to ML and focuses on unsupervised learning and exploratory data analysis?,a : Data analytics | b : Data mining | c : Natural language processing | d : Computer vision,b
"What has been a recent development in ML, outperforming previous approaches?",a : Support Vector Machines (SVM) | b : Artificial Neural Networks (ANN) | c : Decision Trees | d : Genetic Algorithms,b
In what areas has ML been applied with significant impact?,"a : Natural language processing, computer vision, and speech recognition. | b : Medicine, finance, and data mining. | c : Agriculture, email filtering, and robotics. | d : All of the above.",d
